Restaurant,Review,topics,score,topic_name2,keyword
Shabushi (ชาบูชิ) เดอะมอลล์บางกะปิ ชั้น G,"ชาบูชิ สาขาเดอะมอลล์บางกะปิ ตั้งอยู่ประตูหน้าห้าง ตรงข้ามแมคโดนัลเลยค่ะ ขนาดร้านใหญ่โตดี แต่ไปทีไรต้องต่อคิวตลอด สั้นบ้างยาวบ้างแล้วแต่โชคชะตา แต่ห้างมักจะจัดซุ้มออกร้านโน้นนี่ตรงบริเวณลานหน้าร้านให้เลือกชอปเบาๆระหว่างรอ (เป็นกลยุทธ์ที่ดีมากๆ555)

ในร้านก็จะมีทั้งเคาน์เตอร์ยาวหน้าสายพานยาวเป็นแนว แบบหม้อใครหม้อท่าน และโต๊ะแบบหมู่คณะหม้อรวมด้วย

อาหารบนสายพานก็เคลื่อนตัวมาให้เลือกมากมาย คอเนื้อก็แน่นจานดำหยิบวางต้มกันเลยค่า น้ำซุปมีให้เลือก3แบบ ใส ข้น ต้มยำ(ถ้าจำไม่ผิด อิอิ)

คุณภาพอาหารล่าสุดที่ไปทาน ปรับปรุงดีขึ้นมาก ของทานเล่นเช่น ชูชิ ข้าวปั้น ของทอด สลัด ของหวาน ไอติมมีเมนูใหม่ๆเยอะมากขึ้นและเติมตลอด ยอดไปเลย

คุ้มค่าในราคา3xx บาท  แถมมีบัตรสมาชิกเครือโออิชิลดอีก มันดีตรงนี้ละค่า^^ ",3,0.9985917806625366,"['ดี', 'ทาน', 'เลือก', 'อาหาร', 'เนื้อ', 'ราคา', 'น้ำ', 'ค่า', 'คุ้ม', 'หวาน']","['สาย', 'หม้อ', 'ติม', 'หน้า', 'ค่า', '3']"
ข้าน้อยขอชาบู,"หลังจากที่เคยลองสาขายูเนี่ยนมอลล์ไป รอบนี้มาที่สาขาเดอะมอลล์บางกะปิชั้น 4 โซน MCC HALL ด้านในสุดติดกับพวกค่ายมวย ตอนแรกก็นึกว่าชาบู 199 ธรรมดา แต่ที่ไหนได้ มีพิซซ่าจากนารายพิซเซอเรียด้วย

สำหรับราคา 199 บาท จะทานพวกหมูได้ทั้งหมด รวมถึงพิซซ่า ของทอด ซุปต่างๆ แกงเขียวหวาน ได้น้ำซุป 1 รสชาติ

- ถ้าอยากได้น้ำซุปเพิ่มเป็น 2 รสชาติ จ่ายเพิ่มคนละ 40 บาท
- น้ำดื่มรีฟีล 39 บาท
- ส่วนใครอยากทานเนื้อก็เพิ่มคนละ 49 บาท
- ซูชิและของหวานสั่งเพิ่มโดยจ่ายราคาตามเมนู

รวมๆก็ถือว่าอิ่มคุ้มดีนะ ถึงเบค่อนจะมันเยอะไปหน่อย น้ำซุปจะไม่ได้เข้มข้นมากนัก แต่ในราคานี้ มีตัวเลือกให้เท่านี้ วันไหนหิวมากๆก็จะแวะไปใหม่แน่นอน",1,0.9985875487327576,"['กิน', 'ดี', 'น้ำ', 'อาหาร', 'คน', 'เนื้อ', 'ทาน', 'ราคา', 'บาท', 'สด']",['เวลา']
ข้าน้อยขอชาบู,ร้านบุฟเฟ่ต์ที่มีโปรโมชั่นหัวละ199บาท ไม่รวมน้ำ ไม่รวมVAT ไปทานวันธรรมดา ชอบมากเพราะได้เวลาทานตั้ง2ชม. เต็มๆ มีค่าน้ำซุป คนละ10บาท มีน้ำซุปเลือกได้6แบบ แต่หม้อแบ่งได้3ช่อง น้ำซึปต้มยำอร่อยดีครับ แนะนำให้เลือกอันนี้อันนึง ในชุดบุฟเฟ่ต์ ไม่มีซีฟู้ดน่ะครับ แต่อาหารก็มีให้เลือกเยอะน่ะครับ ที่สำคัญมีพิซซ่าอยู่ในชุดบุฟเฟ่ต์ด้วย ของนารายพิซเซอเรีย รับประกันความอร่อย นอกจากนี้ทุกสัปดาห์หลังวันหวยออก เอาลอตเตอรี่ที่ถูกหวยกิน มาแลกฮันนี่โทสฟรีน่ะครับ แนะนำให้มาทานเลยจ้า บุฟเฟ่ต์ร้านนี้ กำเงินมาคนละ300 มีทอนแน่นอนครับ,1,0.9982967972755432,"['กิน', 'ดี', 'น้ำ', 'อาหาร', 'คน', 'เนื้อ', 'ทาน', 'ราคา', 'บาท', 'สด']",['เวลา']
ข้าน้อยขอชาบู,"เคยรู้จักร้านนี้จากที่ union mall ไม่เคยได้ลองกิน แต่จำได้ขึ้นใจจากชื่อร้าน 😆 

จากชื่อก็บอกอยู่แล้วว่าเป็นร้าน ""ชาบู"" แต่เนื่องจากเป็นของ Narai pizzeria ในไลน์อาหารจึงมี pizza ด้วยซะเลย ยังมี สปาเกตตี้ ไก่นิวออลีน

อาหารปรุงสุกก็มีอย่างอื่นอีกนิดหน่อย ที่รู้สึกว่าอร่อยเลยคือ ข้าวมันไก่ 🤣 ตัดกำลังจริงๆ 

พวกของสดก็หลากหลาย บางส่วนอยู่ในตู้ให้หยิบ บางส่วนก็ใช้เขียนสั่งเอา คุณภาพก็เหมาะสมตามราคา

บริการค่อนข้างดี พนักงานขยัน",2,0.9968917369842529,"['เนื้อ', 'น้ำ', 'อร่อย', 'ทาน', 'เลือก', '', 'ดี', 'ราคา', 'อาหาร', 'หวาน']","['', 'หมู', 'ไก่', 'ลอง']"
ข้าน้อยขอชาบู,อร่อยมากค่ะ คุ้มค่าสมราคา บุฟเฟ่หมูผักต่างๆ รวมน้ำด้วยจบที่ 255 /ท่าน เด็ดๆคือมีพิซซ่าบุพเฟ่ ดีเริสมากๆ รสชาตไม่กาไก่เรยนะ คืองานดีเเป้งนุ่มหอมมากๆ  ตบท้ายด้วยของหวานอร่อย โชคดีมากๆไปช่วงโปรโมชั่นของหวานราคา 29 จาก 128 คือ เซตไอติม+บราวนี่+วิปครีม อร่อยยมากกก บุฟเฟ่จุกๆปิดท้ายของหวานเเบบสวยๆ,4,0.9973406195640564,"['ดี', 'เนื้อ', 'ทาน', 'อร่อย', 'สาขา', 'น้ำ', 'เลือก', 'ราคา', 'อาหาร', 'หวาน']","['ชาบู', 'บริการ', 'คุณภาพ', 'พนักงาน', 'นึก', 'นั่ง']"
ข้าน้อยขอชาบู,"ก็ตามที่เขียนเลยครับ ว่า ถ้าจะจ่ายในราคา 199 บาท คุณต้องจ่ายด้วยเงินสดนะครับ และราคานี้ ยังไม่รวมน้ำ และ VAT 7% รวมถึงอย่างอื่นๆ ที่คุณสั่งเพิ่มได้ เช่น เนื้อวัว,ซูชิ,ของหวาน เป็นต้น
แม้จะดูแปลกหน่อย แต่ก็ถือว่าโอเคมาก แม้ซูชิต้องสั่งเพิ่ม แต่ก็มีอาหารอื่นๆ ทดแทน โดยเฉพาะพิซซ่า ที่ได้ลองทั้ง 3 หน้า อร่อยมาก และถ้ากินตอนนำของมาลงสดๆ ร้อนๆ จะอร่อยกว่าปรกติครับ",2,0.9968081116676331,"['เนื้อ', 'น้ำ', 'อร่อย', 'ทาน', 'เลือก', '', 'ดี', 'ราคา', 'อาหาร', 'หวาน']","['', 'หมู', 'ไก่', 'ลอง']"
