Restaurant,Review,topics,score,topic_name2,keyword
Mo-Mo-Paradise (โม โม พาราไดซ์) เดอะมอลล์ บางกะปิ,"ที่สำคัญของร้านนี้คือบริการดีมากพนักงานน่ารักสุดๆสะอาดสะอ้านใส่ใจค่อนข้างประทับใจกับการบริการรสชาติอาหารอันนี้แปลก​ใหม่
เซ็ท560 บาท
อาหารจำกัด​ไม่ได้​หลากหลาย​แต่เพียง​พอกับความต้องการ
เราไม่กินเนื้อ​ กินสันคอ4 ถาด​ เป็ด1
แฟนกินเนื้อ​ คุณ​ภาพ​ดี
น้ำซุป​ดำ​กับเผ็ด
ที่สำคัญคือน้ำจิ้มอร่อยมากไม่เคยกินรสชาติแบบนี้มาก่อนเป็นเต้าเจี้ยวนิดๆแต่ก็ไม่ได้เคลมก็รสชาติดีนะถามราคาโดยรวมก็ถือว่าคุ้มเพราะว่าโมจิอร่อยมากไอติมก็อร่อยไม่ต้องออกไปกินข้างนอกสรุปรวมๆละกันว่าประทับใจในบริการและคุณภาพของอาหาร",1,0.9984667301177979,"['กิน', 'ดี', 'น้ำ', 'อาหาร', 'คน', 'เนื้อ', 'ทาน', 'ราคา', 'บาท', 'สด']",['เวลา']
Mo-Mo-Paradise (โม โม พาราไดซ์) เดอะมอลล์ บางกะปิ,"นึกถึงชาบูญี่ปุ่นยังไงก็ต้อง คิดถึงโมโม่ พาราไดซ์ คุณภาพเค้ามาตราฐานจริงๆ วันนี้มีโอกาสมาทานก่อนร้านปิด 30 นาที ทางร้านก็บริการดี จะมีก็แต่อาหาร เครื่องดื่มที่ทางร้านเริ่มทะยอยเก็บ แต่เราก็เข้าใจเพราะทางร้านแจ้งรายละเอียดการงดรับออร์เดอร์แล้ว 
           สาขานี้ พนักงานบริการดี น่ารักเป็นกันเอง ขออะไรก็ได้หมด ไม่มีเหวี่ยง เคยเจอสาขา พระราม 9 คือ ไม่โอเค พนักงาน ไม่พร้อมทำงานมาก CTW แม้จะเป็นพรีเมียมการบริการก็สู้สาขานี้ไม่ได้ Terminal 21 ลูกค้าเยอะ",4,0.9973406195640564,"['ดี', 'เนื้อ', 'ทาน', 'อร่อย', 'สาขา', 'น้ำ', 'เลือก', 'ราคา', 'อาหาร', 'หวาน']","['ชาบู', 'บริการ', 'คุณภาพ', 'พนักงาน', 'นึก', 'นั่ง']"
Mo-Mo-Paradise (โม โม พาราไดซ์) เดอะมอลล์ บางกะปิ,"มาทานช่วงนี้ สามารถนั่งโต๊ะเดียวกัน หม้อเดียวกันได้แล้ว แต่ระหว่างโต๊ะยังมีฉากกั้นอยู่ 

น้ำซุปเลือกได้ 2 รส น้ำจิ้มก็จะแตกต่างกันตามน้ำซุป เลือกมาเป็นชาบูน้ำดำ กับน้ำซุปเห็ด
ชาบูน้ำดำ : หวานๆเค็มๆ รสชาติเข้มข้น เสิร์ฟพร้อมไข่สด ถ้าเป็นผู้ใหญ่ที่ไม่ชอบหวานๆ อาจจะไม่ค่อยชอบ
น้ำซุปเห็ด : มีชื่อด้วยเป็นภาษาญี่ปุ่น แต่จำไม่ได้555 เสิร์ฟมากับ เห็ด และ น้ำจิ้มซอยซอส รสชาติจืดๆ แนวน้ำซุปใส 

เนื้อสัตว์จะมีให้เลือก เนื้อวัว 2 แบบ, เนื้อหมู 2 แบบ, เนื้อเป็ด, ไก่ไม้ไผ่ เลยสั่งมาลองทุกอย่าง
เนื้อวัว : อร่อยมากก ชิ้นไม่บาง เนื้อนุ่มมากๆ กินกับชาบูน้ำดำเข้ากันมาก
เนื้อหมู : เป็นคุโรบูตะ อร่อยนุ่มลิ้น 
เนื้อเป็ด : จะหนึบๆ ไม่เหนียว ไม่คาว แต่ทานได้จานเดียวรู้สึกว่าพอแล้ว
ไก่ไม้ไผ่ : เป็นไก่บด ลืมถ่ายรูปมา รสชาติกรุบๆ แตาส่วนตัวเฉยๆ 

ช่วงโควิด บาร์ผักกับน้ำ จะมีพนักงานตักให้ เราอยากได้อะไรก็ไปจิ้มๆเลือกๆได้เลย 

ของหวาน มีไอติมกับไดฟูกุ ลองสั่งแต่ไดฟูกุ ไอติมไม่ไหวแย้ววว สั่งมาสามรส สตอเบอรี่ ชาเขียว ถั่วแดง อร่อยทั้งหมดค่ะ

::สรุป:: อร่อยคุ้มค่ากับราคา แต่คงไม่ได้มาทานบ่อยๆ ตกคนละ 600++ แต่ถ้าใครไม่ทานเนื้อวัว อาจจะไม่คุ้มเท่าไร",2,0.9992154240608215,"['เนื้อ', 'น้ำ', 'อร่อย', 'ทาน', 'เลือก', '', 'ดี', 'ราคา', 'อาหาร', 'หวาน']","['', 'หมู', 'ไก่', 'ลอง']"
Mo-Mo-Paradise (โม โม พาราไดซ์) เดอะมอลล์ บางกะปิ,"ถ้านึกถึงชาบูที่มีเนื้อเน้นๆ ในราคาไม่โหดจนเกินไป ก็นึกถึงโมโม่ตลอด บางทีทางร้านก็จะมีโปรมา 4 จ่าย 3 ในวันธรรมดาด้วยนะ
ส่วนตัวชอบเนื้อออส เพราะมันไม่เยอะเกินไป (จริงๆมันเยอะก็อร่อยนะ แต่ทานมากๆแล้วเลี่ยนไว) 

อีกอย่างที่ชอบก็คือไอศกรีมรสชาเขียว และรสข้าว ไปทีไรสั่ง 2 ถ้วยตลอด",4,0.9959293603897095,"['ดี', 'เนื้อ', 'ทาน', 'อร่อย', 'สาขา', 'น้ำ', 'เลือก', 'ราคา', 'อาหาร', 'หวาน']","['ชาบู', 'บริการ', 'คุณภาพ', 'พนักงาน', 'นึก', 'นั่ง']"
Mo-Mo-Paradise (โม โม พาราไดซ์) เดอะมอลล์ บางกะปิ,"เดินมาหน้าร้านแล้วได้กลิ่นชาบูหอมมาก ๆ  ประกอบกับมีโปรบัตรเครดิตด้วย เลยตัดสินใจว่ากินร้านนี้ละกัน น้ำชาบูเลือกได้  2 อย่าง พวกเนื้อต่าง ๆ ต้องสั่งมา ส่วนผักเส้น และลูกชิ้น ไปตักเองได้เลย มีให้เลือกหลากหลายค่ะ 

สาขานี้ที่นั่งกว้างขวาง นั่งสบาย ไม่เหมือนกับสาขา  CTW  ที่จะค่อนข้างแคบ มีเด็กมาด้วยนั่งสบายดีค่ะ 

เนื้อต่าง ๆ คุณภาพดี บริการรวดเร็ว ขนมอร่อยค่ะ",4,0.9968651533126831,"['ดี', 'เนื้อ', 'ทาน', 'อร่อย', 'สาขา', 'น้ำ', 'เลือก', 'ราคา', 'อาหาร', 'หวาน']","['ชาบู', 'บริการ', 'คุณภาพ', 'พนักงาน', 'นึก', 'นั่ง']"
Mo-Mo-Paradise (โม โม พาราไดซ์) เดอะมอลล์ บางกะปิ,"ร้านบุฟเฟ่ ชาบูแนวญี่ปุ่น สายเนื้อหมู เนื้อวัวน่าจะคุ้มมากค่ะ
ทางร้านมีโซนผักให้เลือกหยิบได้เอง 
เนื้อสามารถสั่งผ่านพนักงานได้เลยค่ะ 
ราคามีโปรโมชั่น เป็นบางช่วงนะคะ
ใครชอบน้ำจิ้มพอนซึ ต้องลองค่ะ
ของหวานเราชอบนะ ไอติมบ๋วยอร่อยดี",2,0.9964229464530945,"['เนื้อ', 'น้ำ', 'อร่อย', 'ทาน', 'เลือก', '', 'ดี', 'ราคา', 'อาหาร', 'หวาน']","['', 'หมู', 'ไก่', 'ลอง']"
Mo-Mo-Paradise (โม โม พาราไดซ์) เดอะมอลล์ บางกะปิ,"Number 20 : โมโม – พาราไดส์ (สาขาเดอะมอลบางกะปิ)
ร้านอาหารบุฟเฟ่สุกี้ ชาบูน้ำดำ สไตล์ญี่ปุ่นที่แท้จริง  กรรมวิธีดังเดิม แต่รสชาติ ไทยประยุคก์
วันนี้มาทาน Menu : บุฟเฟ่ต์สุกี้ชาบูน้ำดำ
รายละเอียดเมนู : เลือกน้ำได้หลายแบบ แต่น้ำจิ้มมีแต่พอนซึ และน้ำจิ้มเฉพาะแบบฉบับของร้านโมโมฯ อาหารแบ่งเป็นชุดเซ็ทหมู หรือ เนื้อเลือกได้ ผักมีหลากหลายชนิด
ราคา :  600+บาท / คน  คะแนน : 4.0/5",0,0.9975966215133667,"['ทาน', 'อาหาร', 'ดี', 'น้ำ', 'เลือก', 'เนื้อ', 'กุ้ง', 'ราคา', 'บาท', 'รสชาติ']","['เมนู', 'เทมปุระ', 'ซูชิ', 'บุฟเฟ่ต์', 'จิ้ม']"
Mo-Mo-Paradise (โม โม พาราไดซ์) เดอะมอลล์ บางกะปิ,"ร้านชาบูเฟรนไชส์รสชาติดีมากคุ้มค่าเหมาะสมกับราคาประมาณ500กว่าบาท ติดแต่เรื่องน้ำซุปตอนที่เริ่มงวด อาจจะเค็มขึ้นบ้างแต่ก็เป็นปกติของการกินชาบูอยู่แล้วครับ มีน้ำชาเขียวร้อนและกาแฟด้วย ซึ่งร้านทั่วไปไม่ค่อยมี แต่ที่ชอบเลยคือเนื้อออสเตรเลียดีมากๆครับ หมูสันคอก็รสชาติดีมากเลย แนะนำน้ำซุปสุกี้ยากี้ เสิร์ฟกับน้ำจิ้มไข่ไก่
และโชยุหวาน ส่งนไอศครีมบ๊วยคือดีที่สุดครับ แนะนำต้องไปตำครับ ลุย!!!!",1,0.9979763627052307,"['กิน', 'ดี', 'น้ำ', 'อาหาร', 'คน', 'เนื้อ', 'ทาน', 'ราคา', 'บาท', 'สด']",['เวลา']
Shabushi (ชาบูชิ) เดอะมอลล์บางกะปิ ชั้น G,มา านที่ขาบูชิต้องมาตอนหิว ไม่งั้นจะไม่คุ้มนะครับ ฮ่าๆ เพราะเมนูของกินมันเยอะมาก ทั้งอาหารบนสายพาน อาหารทานเล่น ซูชิ ปูอัด เกี๊ยวซ่า กุ้งเทมปุระ มันละลานตามาก ราคาตอนนี้ 399 บาท แพงมั้ย..ก็นิดนึง แต่ถ้าเทียบกับอาหารแล้วก็ถือว่าคุ้มครับ,1,0.9968505501747131,"['กิน', 'ดี', 'น้ำ', 'อาหาร', 'คน', 'เนื้อ', 'ทาน', 'ราคา', 'บาท', 'สด']",['เวลา']
Shabushi (ชาบูชิ) เดอะมอลล์บางกะปิ ชั้น G,ใครชอบกุ้งทอดเทมปุระ แค่กุ้งเทมปุระก็คุ้มแล้ว ครั้งนี้มาทานดึกไปหน่อยมีของไม่ค่อยมากแล้ว นึกผิดหวังอยู่เพราะเหลือกุ้งเทมปุระอยู่ไม่กี่ตัว แต่ไม่นานก็ทอดใหม่มาเติมเลยได้ทานสมใจ กลายเป็นมาชาบูชิเพื่อทานอาหารญี่ปุนพวกซูชิ กุ้งเทมปุระเป็นหลัก ส่วนชาบูเป็นอาหารเสริมซะงั้น แต่ช่วงนี้จะไม่มีเมนูปลาไข่ชั่วคราวน้ะครับ และยังไงก็อย่าลืมทานไอติมให้เย็นชื่นใจตบท้ายด้วย,0,0.9974468946456909,"['ทาน', 'อาหาร', 'ดี', 'น้ำ', 'เลือก', 'เนื้อ', 'กุ้ง', 'ราคา', 'บาท', 'รสชาติ']","['เมนู', 'เทมปุระ', 'ซูชิ', 'บุฟเฟ่ต์', 'จิ้ม']"
Shabushi (ชาบูชิ) เดอะมอลล์บางกะปิ ชั้น G,กลับมาอัพเดทราคาชาบูชิ ตอนนี้อยู่ที่ 399 บาท net ทานได้ประมาณ 1.15 ชม. น้ำซุปมีให้เลือก 4 รส ซูชิลายตามากๆ เทมปุระก็ทานเพลินๆดี ไปยืนตรงนั้นมีแต่ของน่าทานไปหมด ไลน์ของคาวบุฟเฟ่ต์เน้นกุ้งสด เบค่อน และเนื้อสไลด์ เป็นหลัก อิ่มคุ้มมาก,0,0.9962916970252991,"['ทาน', 'อาหาร', 'ดี', 'น้ำ', 'เลือก', 'เนื้อ', 'กุ้ง', 'ราคา', 'บาท', 'รสชาติ']","['เมนู', 'เทมปุระ', 'ซูชิ', 'บุฟเฟ่ต์', 'จิ้ม']"
Shabushi (ชาบูชิ) เดอะมอลล์บางกะปิ ชั้น G,"ห่างหายไปนานสำหรับชาบูชิ ตั้งแต่ทางร้านได้ปรับขึ้นราคา แถมลดเวลาลงด้วย คุณภาพอาหารดูแย่ลง ก็ลาขาด วันนี้กลับมาอีกครั้ง เนื่องจากได้ยินข่าวมาว่า ""กุ้งปอกเปลือก"" กลับมาแล้ว งานนี้เลยมาเพราะกุ้งค่ะ 

Shabushi ตั้งอยู่ชั้น G ของห้างเดอะมอลล์ บางกะปิ ตัวร้านตั้งอยู่โซนหน้าห้าง ฝั่งติดถนนใหญ่ หาไม่ยากค่ะ ร้านใหญ่ เด่นมาก สำหรับสาขานี้ถ้าเป็นวันเสาร์-อาทิตย์ หรือถ้าตรงกับวันหยุด คนจะเยอะมาก รอคิวนานมากๆ (นี่เป็นอีกหนึ่งสาเหตุที่เลิกกิน) แต่ถ้าเป็นวันธรรมดาคนไม่ค่อยเยอะเท่าไหร่ค่ะ ร้านกว้างขวาง จุคนได้เยอะ แต่ถ้าคนแน่นๆก็รู้สึกแออัดเหมือนกันค่ะ

สำหรับอาหารของสาขานี้ ถ้าเทียบกับสาขาอื่นที่เคยกินแล้วรู้สึกว่า สด สะอาด ในระดับใช้ได้ค่ะ แต่ของบนสายพานออกไม่ครบนะคะ บางรายการต้องขอจากพนักงานค่ะ ถึงจะได้กิน แต่กุ้งสดออกมาตลอดค่ะ ไม่ขาด ถูกใจมาก เพราะวันนี้ตั้งใจมากินกุ้ง ราคาบุฟเฟ่ต์ 359 Net/คน กินได้ 1 ชั่วโมง 15 นาที โดยประมาณค่ะ

อาหารที่ทานวันนี้
- ซูชิ รสชาติธรรมดาค่ะ ปลาดิบสดใช้ได้ 

- โอเด้ง ส่วนใหญ่เป็นลูกชิ้น รสชาติโอเคเลย 

- กุ้งเทมปุระ ทอดมาได้กรอบดี ไม่อมน้ำมัน แต่แป้งหนาไปนิด

- เนื้อสไลด์ เนื้อส่วนนี้ติดมันมานิดๆ นุ่มดีค่ะ 

- เบคอน สไลด์มาบางมาก นุ่มและหอม อร่อย

- กุ้งสด ปอกเปลือกมาอย่างดี จากที่เมื่อก่อนเหมือนกุ้งขาดสารอาหาร สดดี ตัวใหญ่ใช้ได้ กินคนเดียว 5 จานได้ค่ะ

- หอยตลับ ตัวไม่ใหญ่มาก แต่สด เนื้อหวานเด้งดี

- ตับหมู สดและนุ่มดี

- น้ำฝรั่ง เปรี้ยวหวาน ชื่นใจดี แต่วางทิ้งไว้นานๆแล้วจืดค่ะ 

- โฟลตไอศกรีมวานิลา เมนูของหวานที่ทำเองโดยการกดสไปรท์ครึ่งแก้ว แล้วตักไอติมวานิลา 1 ลูกใส่ลงไปก็กินได้แล้วค่ะ หวานหอม ชื่นใจดีค่ะ


โดยรวมแล้วสำหรับมื้อนี้ถือว่าคุ้มค่ะ ไม่ผิดหวังที่กลับมาอีกครั้ง แต่ขอติงเรื่องเวลา 1 ชั่วโมง 15 นาที ส่วนตัวแล้วคิดว่าน้อยไปหน่อยค่ะ ใครที่ไปกินก็ดูเวลานิดนึง อย่ากินเพลิน เหลือเวลาไว้ตอนเช็คบิลด้วยก็ดี ค่ะ เพราะถ้าคนรอเช็คบิลเยอะแล้วยังไม่ถึงคิวเรา ถ้าเกินเวลาจะโดนปรับเอาได้นะคะ (เพื่อนโดนมาแล้วค่ะ)",1,0.9994977712631226,"['กิน', 'ดี', 'น้ำ', 'อาหาร', 'คน', 'เนื้อ', 'ทาน', 'ราคา', 'บาท', 'สด']",['เวลา']
Shabushi (ชาบูชิ) เดอะมอลล์บางกะปิ ชั้น G,"เมื่อหลายวันก่อนนัดหาข้าวทานกับเดอะแกงค์ และก็ลงเอยด้วยอาหารบุฟเฟ่ต์ร้านนี้ค่ะ 

ร้านนี้ตั้งอยุ่ชั้น G ใหญ่พอสมควร

ราคาต่อคน : 359 บาท เวลา1:15 ชม.

รสชาติ: อาหารสด ใหม่
หมุสไลด์ รสชาติดี นุ่ม อร่อย
ซูชิ พอทานได้ค่ะ ออกตลอด 
ไอศกรีม: หลากรส วนิลา สตอเบอร์รี่ ชอคโกแลต มะนาว ฯ
และอื่นๆอีกมากมาย",0,0.9967776536941528,"['ทาน', 'อาหาร', 'ดี', 'น้ำ', 'เลือก', 'เนื้อ', 'กุ้ง', 'ราคา', 'บาท', 'รสชาติ']","['เมนู', 'เทมปุระ', 'ซูชิ', 'บุฟเฟ่ต์', 'จิ้ม']"
Shabushi (ชาบูชิ) เดอะมอลล์บางกะปิ ชั้น G,บอกตรงๆว่าหลายครั้งที่เลือกจะกินบุฟเฟต์จะต้องอารามณ์เสียกับการรอคิวนานๆจนสุดท้ายเลิกรอไม่กินมันซะเลย ยิ่ง Shabushi นะคนเยอะตลอด แต่วันนี้โชคดีคนน้อยน่าจะรอได้ขอจัดซะหน่อยพลาดมาหลายรอบหล่ะ เลยไปจองคิว วันนี้มากินที่สาขาเดอะมอลล์ บางกะปิ ร้านอยู่ชั้น G ใกล้ๆกับประตูปทางเข้าหน้าห้างเลย พอได้ที่นั่งแล้วก็หยิบๆทุกอย่างที่อยากกินแบบชั่วโมงครึ่งนับจากนี้พี่ขอจัดเต็ม โดยร่วมๆเราว่าพวกเนื้อ ผัก ชูชิ ก็ดูโอเคนะผักดูสดกว่าหลายๆร้านที่เป็นบุฟเฟต์สายพานร้านอื่นๆ พนักงานขยันเดินดี ราคาสามร้อยกว่าบาทต่อคนก็ไม่แพงนะ,1,0.9981503486633301,"['กิน', 'ดี', 'น้ำ', 'อาหาร', 'คน', 'เนื้อ', 'ทาน', 'ราคา', 'บาท', 'สด']",['เวลา']
Shabushi (ชาบูชิ) เดอะมอลล์บางกะปิ ชั้น G,สวัสดีครับวันนี้จะขอมารีวิวร้านชาบูชิ บุฟเฟขวัญใจของใครๆ หลายคนเมนูทางร้านมีให้เลือกมากมาย ผ่านระบบสายพานที่ให้ลูกค้าสามารถหยิบได้อย่างทั่วถึง มีทั้งข้อดีและเสีย 555 การบริการก็ดีครับ เก้บจานที่ใช้แล้วอยู่เรื่อย นํ้าซุปก็สามารถเลือกได้ตามแบบที่ต้องการ นํ้าจิ้มก็อร่อยครับ ใครมี่ไม่เคยทานต้องลองทานดูนะครับอร่อยคุ้ม,2,0.9964229464530945,"['เนื้อ', 'น้ำ', 'อร่อย', 'ทาน', 'เลือก', '', 'ดี', 'ราคา', 'อาหาร', 'หวาน']","['', 'หมู', 'ไก่', 'ลอง']"
